{
  "schemaVersion": "2.2.0",
  "contentSystemVersion": "1",
  "courseCode": "en-fa",
  "levelKey": "A1",
  "lessonKey": "EN-A1-L-0122",
  "sortOrder": 122,
  "titleEn": "This course is new",
  "titleFa": "این دوره جدید است",
  "descriptionFa": "با course درباره یک دوره آموزشی ساده حرف بزن.",
  "primaryOutcomeKey": "EN-A1-OUTCOME-0122",
  "outcomeFa": "course را به معنی «دوره آموزشی» در دو جمله کوتاه به کار ببری.",
  "scenarioFa": "مایا و الکس بعد از کلاس در مرکز آموزشی پوستر دو دوره زبان را می‌بینند و درباره آنها حرف می‌زنند.",
  "prerequisiteOutcomeKeys": [
    "EN-A1-OUTCOME-0121"
  ],
  "curriculum": {
    "startingKnowledge": "early_a1_spoken_core_and_recent_review",
    "targetConstructions": [
      {
        "key": "EN-CONSTR-0122-COURSE",
        "form": "This course is new",
        "meaningFa": "توصیف یک دوره آموزشی"
      }
    ],
    "supportLanguage": [
      {
        "form": "What is this?",
        "meaningFa": "این چیست؟"
      },
      {
        "form": "And the English course?",
        "meaningFa": "دوره انگلیسی چطور؟"
      }
    ],
    "assessmentBoundary": "Only the bounded A1 education-series noun sense of course is assessed.",
    "transferPlan": {
      "mode": "same_lesson",
      "intent": "Reuse course with a second familiar course description."
    },
    "story": {
      "arcKey": "EN-A1-CLASSMATES",
      "sceneKey": "EN-A1-FACTORY-SCENE-0122",
      "learnerRoleKey": "maya",
      "participants": [
        "alex",
        "maya"
      ],
      "introducedCharacterKeys": [],
      "relationshipState": "already_known",
      "dependsOnLessonKeys": [
        "EN-A1-L-0117"
      ],
      "continuesLessonKey": "EN-A1-L-0117",
      "settingFa": "مرکز آموزشی، کنار پوستر دوره‌ها",
      "storyBeatFa": "الکس درباره پوسترها می‌پرسد و مایا با course دو دوره آموزشی را توصیف می‌کند."
    },
    "reviewLinks": [
      {
        "lessonKey": "EN-A1-L-0117",
        "activityKeys": [
          "A02"
        ],
        "learningDemand": "retrieval",
        "note": "Returning classmates arc is spaced by 5 Lessons and the played role changes from Alex to Maya."
      }
    ],
    "languageReference": {
      "specKey": "en-fa-A1-LESSON-SPEC-0122",
      "specHash": "46bf4f763453969ed4d0b31e4969c664d86b2fb43cd9c8b757d6a182488a8a8e",
      "grammarTargetKeys": [],
      "reviewLexicalLemmas": [],
      "usageFallbacks": [
        {
          "query": "this course is new",
          "rationale": "Bounded collocation for the education-series noun sense of course."
        },
        {
          "query": "the English course is good",
          "rationale": "Changed-description collocation preserving the same sense."
        },
        {
          "query": "the English course",
          "rationale": "Exact target-collocation window from the follow-up prompt; natural noun phrase for an educational course."
        }
      ],
      "noNewGrammarReason": "Lexical-focus Lesson using familiar A1 sentence patterns; no new grammar is claimed."
    },
    "pedagogyVersion": 2
  },
  "lexicalItems": [
    {
      "lexicalKey": "EN-LEX-COURSE-01",
      "itemType": "word",
      "displayForm": "course",
      "translationFa": "دوره",
      "role": "target",
      "lemma": "course",
      "partOfSpeech": "noun",
      "senseKey": "fd594260-e45b-558b-814f-cf7b22d53a67",
      "audioEligible": true,
      "metadata": {
        "referenceKey": "EN-REF-F432FE5C141F6B2C3BB4"
      }
    }
  ],
  "turns": [
    {
      "turnKey": "T01",
      "role": "character",
      "characterKey": "alex",
      "textEn": "What is this?",
      "translationFa": "این چیست؟",
      "audioRequired": true
    },
    {
      "turnKey": "T02",
      "role": "learner",
      "characterKey": "maya",
      "textEn": "This course is new.",
      "translationFa": "این دوره جدید است.",
      "audioRequired": true,
      "speechTargetEn": "This course is new.",
      "acceptedSpeechEn": [
        "This course is new."
      ]
    },
    {
      "turnKey": "T03",
      "role": "character",
      "characterKey": "alex",
      "textEn": "And the English course?",
      "translationFa": "دوره انگلیسی چطور؟",
      "audioRequired": true
    },
    {
      "turnKey": "T04",
      "role": "learner",
      "characterKey": "maya",
      "textEn": "The English course is good.",
      "translationFa": "دوره انگلیسی خوب است.",
      "audioRequired": true,
      "speechTargetEn": "The English course is good.",
      "acceptedSpeechEn": [
        "The English course is good."
      ],
      "metadata": {
        "usage": "changed_context_transfer"
      }
    }
  ],
  "activities": [
    {
      "activityKey": "A01",
      "type": "response_choice",
      "instructionFa": "معنی course را در این درس پیدا کن.",
      "promptFa": "course اینجا چه معنی‌ای دارد؟",
      "promptEn": "This course is new",
      "config": {
        "options": [
          "دوره",
          "خودرو",
          "پیام"
        ],
        "answerIndex": 0,
        "feedback": {
          "optionsFa": [
            "درست است.",
            "این معنی هدف درس نیست.",
            "این گزینه با موقعیت جور نیست."
          ],
          "correctFa": "دوره"
        }
      },
      "metadata": {
        "learningDemand": "recognition",
        "evidenceKind": "recognition_or_selection"
      }
    },
    {
      "activityKey": "A02",
      "type": "dialogue",
      "instructionFa": "حرف شخصیت مقابل را گوش کن و جواب نقش خودت را بگو.",
      "config": {
        "mode": "guided_exchange",
        "exchanges": [
          {
            "exchangeKey": "E01",
            "promptTurnKey": "T01",
            "responseTurnKey": "T02",
            "responseEvaluation": "practice_only",
            "allowPromptReplay": true,
            "allowResponseModelAudio": true
          },
          {
            "exchangeKey": "E02",
            "promptTurnKey": "T03",
            "responseTurnKey": "T04",
            "responseEvaluation": "practice_only",
            "allowPromptReplay": true,
            "allowResponseModelAudio": true
          }
        ],
        "showPromptText": true,
        "showPromptTranslation": true,
        "showResponseText": true,
        "showResponseTranslation": true
      }
    },
    {
      "activityKey": "A03",
      "type": "comprehension",
      "instructionFa": "بخش اول گفت‌وگو را گوش کن.",
      "promptFa": "مایا درباره این دوره چه می‌گوید؟",
      "config": {
        "sourceTurnKeys": [
          "T01",
          "T02"
        ],
        "options": [
          "جدید است.",
          "یک ماشین است.",
          "شاید بسته است."
        ],
        "answerIndex": 0,
        "transcriptAfterAttempt": true,
        "feedback": {
          "optionsFa": [
            "درست است.",
            "این گفته نشد.",
            "این با گفت‌وگو جور نیست."
          ],
          "correctFa": "جدید است."
        }
      },
      "metadata": {
        "learningDemand": "recognition",
        "evidenceKind": "recognition_or_selection",
        "skillFocus": "listening"
      }
    },
    {
      "activityKey": "A04",
      "type": "response_choice",
      "instructionFa": "جمله درست را انتخاب کن.",
      "promptFa": "این دوره جدید است.",
      "config": {
        "optionsEn": [
          "This course is new.",
          "This course is good.",
          "This course is important."
        ],
        "answerIndex": 0,
        "feedback": {
          "optionsFa": [
            "درست است.",
            "good یعنی دوره خوب است و معنی «جدید» را نمی‌رساند.",
            "important یعنی دوره مهم است و با صفت «جدید» فرق دارد."
          ],
          "correctFa": "This course is new."
        }
      },
      "metadata": {
        "learningDemand": "recognition",
        "evidenceKind": "recognition_or_selection"
      }
    },
    {
      "activityKey": "A05",
      "type": "response_choice",
      "instructionFa": "جواب موقعیت دوم را انتخاب کن.",
      "promptFa": "دوره انگلیسی چطور؟",
      "config": {
        "optionsEn": [
          "The English course is good.",
          "The English course is new.",
          "This course is important."
        ],
        "answerIndex": 0,
        "feedback": {
          "optionsFa": [
            "درست است.",
            "این گزینه می‌گوید دوره انگلیسی جدید است، نه خوب.",
            "این گزینه درباره «این دوره» و مهم بودن آن است، نه دوره انگلیسی."
          ],
          "correctFa": "دوره انگلیسی خوب است."
        }
      },
      "metadata": {
        "learningDemand": "transfer",
        "evidenceKind": "recognition_or_selection"
      }
    },
    {
      "activityKey": "A06",
      "type": "speak",
      "instructionFa": "جواب انگلیسی پنهان است؛ خودت بگو.",
      "promptFa": "مایا هستی. بگو: دوره انگلیسی خوب است.",
      "config": {
        "mode": "retrieval",
        "textEn": "The English course is good.",
        "acceptedAnswersEn": [
          "The English course is good."
        ],
        "sourceTurnKey": "T04",
        "showAnswerTextBeforeAttempt": false,
        "hintFa": "course یعنی «دوره آموزشی».",
        "feedback": {
          "correctFa": "درست است؛ course را در موقعیت دوم بازیابی کردی.",
          "retryFa": "جمله کوتاه را دوباره بساز."
        },
        "evidenceKind": "bounded_retrieval",
        "practiceOnly": false,
        "modelAccess": "explicit_help"
      },
      "metadata": {
        "learningDemand": "retrieval",
        "assessmentLimit": "Same-session bounded retrieval in a changed controlled context."
      }
    }
  ],
  "review": {
    "pendingDecisions": []
  },
  "metadata": {
    "pilot": false,
    "audioRequired": true,
    "humanEnglishAuditRequired": true,
    "dialogueRuntime": "guided_exchange",
    "qualityStage": "model_reviewed_for_testing"
  }
}
