{
  "schemaVersion": "2.2.0",
  "contentSystemVersion": "1",
  "courseCode": "en-fa",
  "levelKey": "A1",
  "lessonKey": "EN-A1-L-0115",
  "sortOrder": 115,
  "titleEn": "One run for our team",
  "titleFa": "یک امتیاز برای تیم ما",
  "descriptionFa": "با run درباره یک امتیاز در بیسبال حرف بزن.",
  "primaryOutcomeKey": "EN-A1-OUTCOME-0115",
  "outcomeFa": "run را در معنای «امتیاز در بیسبال» در دو جمله کوتاه تشخیص بدهی و به کار ببری.",
  "scenarioFa": "لیو و لیام بخشی از یک بازی بیسبال را روی صفحه کتابخانه می‌بینند و درباره امتیاز تیم حرف می‌زنند.",
  "prerequisiteOutcomeKeys": [
    "EN-A1-OUTCOME-0114"
  ],
  "curriculum": {
    "startingKnowledge": "early_a1_spoken_core_and_recent_review",
    "targetConstructions": [
      {
        "key": "EN-CONSTR-0115-RUN",
        "form": "That's one run",
        "meaningFa": "گفتن یک امتیاز در بیسبال"
      }
    ],
    "supportLanguage": [
      {
        "form": "Did our team score?",
        "meaningFa": "تیم ما امتیاز گرفت؟"
      },
      {
        "form": "Another one?",
        "meaningFa": "یکی دیگر؟"
      }
    ],
    "assessmentBoundary": "Only the bounded baseball-score noun sense of run provided by the committed lexical reference is assessed.",
    "transferPlan": {
      "mode": "same_lesson",
      "intent": "Reuse the same baseball-score sense with a second count."
    },
    "story": {
      "arcKey": "EN-A1-LIBRARY",
      "sceneKey": "EN-A1-FACTORY-SCENE-0115",
      "learnerRoleKey": "liam",
      "participants": [
        "leo",
        "liam"
      ],
      "introducedCharacterKeys": [],
      "relationshipState": "already_known",
      "dependsOnLessonKeys": [
        "EN-A1-L-0110"
      ],
      "continuesLessonKey": "EN-A1-L-0110",
      "settingFa": "کتابخانه، کنار صفحه نمایش بازی",
      "storyBeatFa": "لیو درباره امتیاز تیم می‌پرسد و لیام با run تعداد امتیازهای بیسبال را می‌گوید."
    },
    "reviewLinks": [
      {
        "lessonKey": "EN-A1-L-0110",
        "activityKeys": [
          "A02"
        ],
        "learningDemand": "retrieval",
        "note": "Returning library arc is spaced by 5 Lessons and the played role changes from Leo to Liam."
      }
    ],
    "languageReference": {
      "specKey": "en-fa-A1-LESSON-SPEC-0115",
      "specHash": "ce17743ae48e9b055cdcec3cab6546f04405e3a10bcb79982c166a0546190cce",
      "grammarTargetKeys": [],
      "reviewLexicalLemmas": [],
      "usageFallbacks": [
        {
          "query": "that's one run",
          "rationale": "Exact bounded learner collocation for the baseball-score noun sense of run."
        },
        {
          "query": "that's two runs",
          "rationale": "Changed-count collocation preserving the same baseball-score sense."
        }
      ],
      "noNewGrammarReason": "Lexical-focus Lesson; the committed reference sense is a noun, so no unrelated V-ing grammar target is claimed."
    },
    "pedagogyVersion": 2
  },
  "lexicalItems": [
    {
      "lexicalKey": "EN-LEX-RUN-BASEBALL-01",
      "itemType": "word",
      "displayForm": "run",
      "translationFa": "امتیاز در بیسبال",
      "role": "target",
      "lemma": "run",
      "partOfSpeech": "noun",
      "senseKey": "601b0bca-5dde-5bb1-aed0-c67c3c8a39a7",
      "audioEligible": true,
      "metadata": {
        "referenceKey": "EN-REF-0C1AC9FF6BDD13AF075C"
      }
    }
  ],
  "turns": [
    {
      "turnKey": "T01",
      "role": "character",
      "characterKey": "leo",
      "textEn": "Did our team score?",
      "translationFa": "تیم ما امتیاز گرفت؟",
      "audioRequired": true
    },
    {
      "turnKey": "T02",
      "role": "learner",
      "characterKey": "liam",
      "textEn": "Yes. That's one run.",
      "translationFa": "بله. این یک امتیاز است.",
      "audioRequired": true,
      "speechTargetEn": "Yes. That's one run.",
      "acceptedSpeechEn": [
        "Yes. That's one run."
      ]
    },
    {
      "turnKey": "T03",
      "role": "character",
      "characterKey": "leo",
      "textEn": "Another one?",
      "translationFa": "یکی دیگر؟",
      "audioRequired": true
    },
    {
      "turnKey": "T04",
      "role": "learner",
      "characterKey": "liam",
      "textEn": "Yes. That's two runs now.",
      "translationFa": "بله. حالا دو امتیاز شده.",
      "audioRequired": true,
      "speechTargetEn": "Yes. That's two runs now.",
      "acceptedSpeechEn": [
        "Yes. That's two runs now."
      ],
      "metadata": {
        "usage": "changed_context_transfer"
      }
    }
  ],
  "activities": [
    {
      "activityKey": "A01",
      "type": "response_choice",
      "instructionFa": "معنی run را در این درس پیدا کن.",
      "promptFa": "run اینجا چه معنی‌ای دارد؟",
      "promptEn": "That's one run.",
      "config": {
        "options": [
          "امتیاز در بیسبال",
          "دویدن",
          "شغل"
        ],
        "answerIndex": 0,
        "feedback": {
          "optionsFa": [
            "درست است.",
            "در این درس run فعل «دویدن» نیست.",
            "این معنی job است."
          ],
          "correctFa": "امتیاز در بیسبال"
        }
      },
      "metadata": {
        "learningDemand": "recognition",
        "evidenceKind": "recognition_or_selection"
      }
    },
    {
      "activityKey": "A02",
      "type": "dialogue",
      "instructionFa": "حرف‌های لیو را گوش کن و جواب لیام را بگو.",
      "config": {
        "mode": "guided_exchange",
        "exchanges": [
          {
            "exchangeKey": "E01",
            "promptTurnKey": "T01",
            "responseTurnKey": "T02",
            "responseEvaluation": "practice_only",
            "allowPromptReplay": true,
            "allowResponseModelAudio": true
          },
          {
            "exchangeKey": "E02",
            "promptTurnKey": "T03",
            "responseTurnKey": "T04",
            "responseEvaluation": "practice_only",
            "allowPromptReplay": true,
            "allowResponseModelAudio": true
          }
        ],
        "showPromptText": true,
        "showPromptTranslation": true,
        "showResponseText": true,
        "showResponseTranslation": true
      }
    },
    {
      "activityKey": "A03",
      "type": "comprehension",
      "instructionFa": "بخش اول را گوش کن.",
      "promptFa": "لیام چند run می‌گوید؟",
      "config": {
        "sourceTurnKeys": [
          "T01",
          "T02"
        ],
        "options": [
          "یک امتیاز",
          "دو امتیاز",
          "هیچ امتیازی"
        ],
        "answerIndex": 0,
        "transcriptAfterAttempt": true,
        "feedback": {
          "optionsFa": [
            "درست است.",
            "این مربوط به بخش دوم است.",
            "او یک امتیاز می‌گوید."
          ],
          "correctFa": "یک امتیاز"
        }
      },
      "metadata": {
        "learningDemand": "recognition",
        "evidenceKind": "recognition_or_selection",
        "skillFocus": "listening"
      }
    },
    {
      "activityKey": "A04",
      "type": "response_choice",
      "instructionFa": "جمله درست را انتخاب کن.",
      "promptFa": "این یک امتیاز در بیسبال است.",
      "config": {
        "optionsEn": [
          "That's one run.",
          "That's one job.",
          "That's one open."
        ],
        "answerIndex": 0,
        "feedback": {
          "optionsFa": [
            "درست است.",
            "job یعنی شغل.",
            "open در این ساختار درست نیست."
          ],
          "correctFa": "That's one run."
        }
      },
      "metadata": {
        "learningDemand": "recognition",
        "evidenceKind": "recognition_or_selection"
      }
    },
    {
      "activityKey": "A05",
      "type": "response_choice",
      "instructionFa": "جواب موقعیت دوم را انتخاب کن.",
      "promptFa": "یکی دیگر؟",
      "config": {
        "optionsEn": [
          "Yes. That's two runs now.",
          "Yes. I run now.",
          "Yes. There is a job now."
        ],
        "answerIndex": 0,
        "feedback": {
          "optionsFa": [
            "درست است.",
            "این run را به فعل دویدن تغییر می‌دهد.",
            "این درباره job است."
          ],
          "correctFa": "بله. حالا دو امتیاز شده."
        }
      },
      "metadata": {
        "learningDemand": "transfer",
        "evidenceKind": "recognition_or_selection"
      }
    },
    {
      "activityKey": "A06",
      "type": "speak",
      "instructionFa": "جواب انگلیسی پنهان است؛ خودت بگو.",
      "promptFa": "لیام هستی. بگو: بله. حالا دو امتیاز شده.",
      "config": {
        "mode": "retrieval",
        "textEn": "Yes. That's two runs now.",
        "acceptedAnswersEn": [
          "Yes. That's two runs now."
        ],
        "sourceTurnKey": "T04",
        "showAnswerTextBeforeAttempt": false,
        "hintFa": "run اینجا یک اسم به معنی امتیاز بیسبال است.",
        "feedback": {
          "correctFa": "درست است؛ همان معنی اسمی run را بازیابی کردی.",
          "retryFa": "جمله کوتاه را دوباره بساز."
        },
        "evidenceKind": "bounded_retrieval",
        "practiceOnly": false,
        "modelAccess": "explicit_help"
      },
      "metadata": {
        "learningDemand": "retrieval",
        "assessmentLimit": "Same-session bounded retrieval in a changed controlled context."
      }
    }
  ],
  "review": {
    "pendingDecisions": []
  },
  "metadata": {
    "pilot": false,
    "audioRequired": true,
    "humanEnglishAuditRequired": true,
    "dialogueRuntime": "guided_exchange",
    "qualityStage": "model_reviewed_for_testing"
  }
}
